{
  "name": "c_patternchange",
  "args": [],
  "source": "rj/c_patternchange-help.pd:2-16,167-183 + rj/c_patternchange.pd:198-214",
  "duration_ms": 1000,
  "stimuli": [
    {
      "inlet": 1,
      "at_ms": 0,
      "message": [
        1,
        2,
        3,
        4,
        5
      ]
    },
    {
      "inlet": 0,
      "at_ms": 10,
      "message": [
        "retrograde"
      ]
    },
    {
      "inlet": 0,
      "at_ms": 20,
      "message": [
        "transpose",
        2
      ]
    },
    {
      "inlet": 0,
      "at_ms": 30,
      "message": [
        "rotate",
        1
      ]
    }
  ],
  "expect": [
    {
      "outlet": 0,
      "kind": "control",
      "min_messages": 3,
      "type": "list",
      "exact": [
        [
          5,
          4,
          3,
          2,
          1
        ],
        [
          3,
          4,
          5,
          6,
          7
        ],
        [
          2,
          3,
          4,
          5,
          1
        ]
      ]
    },
    {
      "outlet": 1,
      "kind": "control",
      "min_messages": 3,
      "type": "any",
      "exact": [
        [
          "retrograde"
        ],
        [
          "transpose",
          2
        ],
        [
          "rotate",
          1
        ]
      ]
    }
  ],
  "notes": "Transforms always read the stored original list, not the previous transformed output. Second outlet reports each requested operation; mixed selectors are asserted exactly rather than accepted as arbitrary output."
}
