{
  "name": "u_listfilter",
  "args": [],
  "source": "rj/u_listfilter-help.pd:18-40,46 + rj/u_listfilter.pd:2-18",
  "duration_ms": 100,
  "stimuli": [
    {
      "inlet": 0,
      "at_ms": 10,
      "message": [
        0,
        1,
        2,
        3,
        4,
        5
      ]
    },
    {
      "inlet": 0,
      "at_ms": 30,
      "message": [
        "bang"
      ]
    }
  ],
  "expect": [
    {
      "outlet": 0,
      "kind": "control",
      "min_messages": 2,
      "type": "list",
      "exact": [
        [
          3,
          4,
          5
        ],
        [
          3,
          4,
          5
        ]
      ]
    },
    {
      "outlet": 1,
      "kind": "control",
      "min_messages": 12,
      "type": "float",
      "exact": [
        [
          0
        ],
        [
          1
        ],
        [
          2
        ],
        [
          3
        ],
        [
          4
        ],
        [
          5
        ],
        [
          0
        ],
        [
          1
        ],
        [
          2
        ],
        [
          3
        ],
        [
          4
        ],
        [
          5
        ]
      ]
    }
  ],
  "notes": "The help threshold example keeps only elements >=3; bang repeats the saved input list. Inlet1 is intentionally absent from timed stimuli because the real >=3 Pd feedback fixture drives it synchronously from outlet1, as required by the abstraction contract. Each original element must still appear at the right outlet.",
  "feedback": [
    {
      "outlet": 1,
      "inlet": 1,
      "object": ">= 3"
    }
  ]
}
