{
  "name": "u_samplekit2",
  "args": [
    "rjqa_kit2"
  ],
  "source": "rj/u_samplekit2-help.pd:20-37 + rj/u_samplekit2.pd:4-16,59-62",
  "duration_ms": 100,
  "stimuli": [
    {
      "inlet": 0,
      "at_ms": 10,
      "message": [
        "open",
        ".",
        "index_stereo.txt"
      ]
    },
    {
      "inlet": 0,
      "at_ms": 20,
      "message": [
        0
      ]
    },
    {
      "inlet": 0,
      "at_ms": 30,
      "message": [
        "dump"
      ]
    },
    {
      "inlet": 0,
      "at_ms": 40,
      "message": [
        "size",
        0
      ]
    }
  ],
  "expect": [
    {
      "outlet": 0,
      "kind": "control",
      "min_messages": 1,
      "type": "any",
      "exact": [
        [
          "rjqa_kit2-0"
        ]
      ]
    },
    {
      "outlet": 1,
      "kind": "control",
      "min_messages": 2,
      "type": "any",
      "exact": [
        [
          0,
          "rjqa_kit2-0"
        ],
        [
          "size",
          0,
          22050
        ]
      ]
    }
  ],
  "notes": "Real sample kit: generated mapping text contains sine440_1s_stereo.wav 0, matching the documented filename/index format. open uses that map to create and fill stereo -1/-2 tables. Lookup0 returns the basename, dump returns[0,basename], and size0 reports22050 frames. The custom generated index replaces unavailable external drum-kit assets.",
  "files": [
    "generated:sine440_1s_stereo.wav",
    "generated:index_stereo.txt"
  ]
}
