{
  "name": "e_chorusr",
  "args": [
    "mychorus"
  ],
  "source": "rj/e_chorusr-help.pd:43-62 + rj/e_chorusr.pd:13-35,54-61,111-122",
  "duration_ms": 1000,
  "stimuli": [
    {
      "inlet": 0,
      "signal": {
        "kind": "sine",
        "amp": 0.5,
        "freq": 440
      }
    },
    {
      "inlet": 1,
      "at_ms": 0,
      "message": [
        "freq",
        0.8
      ]
    },
    {
      "inlet": 1,
      "at_ms": 0,
      "message": [
        "mod",
        1.3
      ]
    }
  ],
  "expect": [
    {
      "outlet": 0,
      "kind": "signal",
      "rms": [
        0.05,
        0.37
      ],
      "window_ms": [
        200,
        1000
      ]
    },
    {
      "outlet": 1,
      "kind": "signal",
      "rms": [
        0.05,
        0.37
      ],
      "window_ms": [
        200,
        1000
      ]
    }
  ],
  "notes": "Roland-style chorus divides the base frequency into four delay modulators at 1, 1/2, 1/4 and 1/8; two half-level taps are summed on each stereo outlet, giving a non-silent output bounded around input level."
}
