{
  "name": "u_makepoly",
  "args": [
    8,
    1,
    "s_rhodey",
    "rjqa_MYINST"
  ],
  "source": "rj/u_makepoly-help.pd:14-35,57-63 + rj/u_makepoly.pd:2-15 + rj/s_rhodey.pd:79-114",
  "duration_ms": 1000,
  "stimuli": [
    {
      "inlet": 1,
      "at_ms": 0,
      "message": [
        "tone",
        0.5
      ]
    },
    {
      "inlet": 1,
      "at_ms": 0,
      "message": [
        "mod",
        1
      ]
    },
    {
      "inlet": 1,
      "at_ms": 0,
      "message": [
        "adsr24",
        127
      ]
    },
    {
      "inlet": 1,
      "at_ms": 0,
      "message": [
        "decay",
        1500
      ]
    },
    {
      "inlet": 0,
      "at_ms": 20,
      "message": [
        60,
        100
      ]
    },
    {
      "inlet": 0,
      "at_ms": 200,
      "message": [
        64,
        100
      ]
    },
    {
      "inlet": 0,
      "at_ms": 500,
      "message": [
        60,
        0
      ]
    },
    {
      "inlet": 0,
      "at_ms": 700,
      "message": [
        64,
        0
      ]
    }
  ],
  "expect": [
    {
      "outlet": 0,
      "kind": "signal",
      "rms": [
        0.01,
        1.5
      ],
      "window_ms": [
        100,
        400
      ]
    },
    {
      "outlet": 1,
      "kind": "signal",
      "window_ms": [
        100,
        1000
      ],
      "silent": true
    }
  ],
  "notes": "Use the help creation arguments8 voices, stealing1, s_rhodey, with the example parent $0-MYINST replaced by a unique literal. Loadbang dynamically creates the actual eight FM instruments; MIDI note/velocity and shared controls must produce bounded summed audio. The stereo wrapper dynamically attempts connect instrument outlet1 to the right throw, but s_rhodey has only outlet0. Expected exact diagnostic category is connection failed (missing outlet1 of s_rhodey), not an unresolved class. Help explicitly says the right outlet is unused; it must stay silent.",
  "expected_result": "instantiates-with-errors"
}
