{
  "name": "s_vphasor",
  "args": [],
  "source": "rj/s_vphasor-help.pd:11-20 + rj/s_vphasor.pd:2-3,34-50",
  "duration_ms": 1000,
  "stimuli": [
    {
      "inlet": 0,
      "signal": {
        "kind": "dc",
        "amp": 1234
      }
    },
    {
      "inlet": 1,
      "at_ms": 0,
      "message": [
        0.25
      ]
    },
    {
      "inlet": 1,
      "at_ms": 500,
      "message": [
        0.75
      ]
    }
  ],
  "expect": [
    {
      "outlet": 0,
      "kind": "signal",
      "rms": [
        0.56,
        0.6
      ],
      "window_ms": [
        100,
        1000
      ]
    }
  ],
  "notes": "Sample-accurate phasor frequency and phase reset. DC 1234 is frequency, not audio amplitude. wrap~ bounds output to [0,1], so a many-cycle ramp has RMS sqrt(1/3); both phase settings exercise the message inlet."
}
