{
  "name": "m_speedlimit",
  "args": [
    100
  ],
  "source": "rj/m_speedlimit-help.pd:10-17 + rj/m_speedlimit.pd:2-38,55-75",
  "duration_ms": 450,
  "stimuli": [
    {
      "inlet": 1,
      "at_ms": 10,
      "message": [
        100
      ]
    },
    {
      "inlet": 0,
      "at_ms": 20,
      "message": [
        1
      ]
    },
    {
      "inlet": 0,
      "at_ms": 40,
      "message": [
        2
      ]
    },
    {
      "inlet": 0,
      "at_ms": 60,
      "message": [
        3
      ]
    },
    {
      "inlet": 0,
      "at_ms": 300,
      "message": [
        4
      ]
    }
  ],
  "expect": [
    {
      "outlet": 0,
      "kind": "control",
      "min_messages": 3,
      "type": "float",
      "exact": [
        [
          1
        ],
        [
          3
        ],
        [
          4
        ]
      ],
      "range": [
        1,
        4
      ]
    }
  ],
  "notes": "First message passes immediately; values2/3 arriving within100ms are sampled as the latest3 at the next metro tick. Inactivity stops/reopens the gate, so a later4 passes immediately. Both public inlets are driven."
}
