{
  "name": "e_pan",
  "args": [
    0.5
  ],
  "source": "rj/e_pan-help.pd:19-31 + rj/e_pan.pd:3-11,39-44",
  "duration_ms": 1000,
  "stimuli": [
    {
      "inlet": 0,
      "signal": {
        "kind": "sine",
        "amp": 0.5,
        "freq": 440
      }
    },
    {
      "inlet": 1,
      "at_ms": 0,
      "message": [
        0.5
      ]
    },
    {
      "inlet": 1,
      "at_ms": 600,
      "message": [
        0
      ]
    }
  ],
  "expect": [
    {
      "outlet": 0,
      "kind": "signal",
      "rms": [
        0.24,
        0.26
      ],
      "window_ms": [
        200,
        500
      ]
    },
    {
      "outlet": 1,
      "kind": "signal",
      "rms": [
        0.24,
        0.26
      ],
      "window_ms": [
        200,
        500
      ]
    },
    {
      "outlet": 0,
      "kind": "signal",
      "rms": [
        0.34,
        0.37
      ],
      "window_ms": [
        650,
        1000
      ]
    },
    {
      "outlet": 1,
      "kind": "signal",
      "rms": [
        0,
        0.0001
      ],
      "window_ms": [
        650,
        1000
      ],
      "silent": true
    }
  ],
  "notes": "Equal-power panner uses cosine/sine half-angle gains: center yields RMS 0.25 in each channel from a 0.5 sine. Hard-left at 600 ms restores the full left RMS and silences right after 10 ms interpolation."
}
