{
  "name": "e_chorus",
  "args": [
    "mychorus"
  ],
  "source": "rj/e_chorus-help.pd:43-57 + rj/e_chorus.pd:16-39,103-112",
  "duration_ms": 1000,
  "stimuli": [
    {
      "inlet": 0,
      "signal": {
        "kind": "sine",
        "amp": 0.5,
        "freq": 440
      }
    },
    {
      "inlet": 1,
      "at_ms": 0,
      "message": [
        "freq",
        0.8
      ]
    },
    {
      "inlet": 1,
      "at_ms": 0,
      "message": [
        "mod",
        1.3
      ]
    }
  ],
  "expect": [
    {
      "outlet": 0,
      "kind": "signal",
      "rms": [
        0.05,
        0.37
      ],
      "window_ms": [
        200,
        1000
      ]
    },
    {
      "outlet": 1,
      "kind": "signal",
      "rms": [
        0.05,
        0.37
      ],
      "window_ms": [
        200,
        1000
      ]
    }
  ],
  "notes": "Four modulated delay taps each read a half-amplitude input; opposing taps are summed per stereo outlet. The 1.3 ms modulation at 0.8 Hz creates phase-dependent attenuation but cannot exceed the input RMS envelope by amplification. Both actual source outlets are checked although REFERENCE lists only one."
}
