{
  "name": "g_pattern32",
  "args": [
    "cor06-pattern",
    1
  ],
  "source": "rj/g_pattern32-help.pd:31-50,73-79 + rj/g_pattern32.pd:74-100,152-156",
  "duration_ms": 500,
  "stimuli": [
    {
      "inlet": 1,
      "at_ms": 20,
      "message": [
        1,
        0,
        0.5,
        0,
        0,
        0,
        0,
        0,
        0,
        0,
        0,
        0,
        0,
        0,
        0,
        0,
        0,
        0,
        0,
        0,
        0,
        0,
        0,
        0,
        0,
        0,
        0,
        0,
        0,
        0,
        0,
        0
      ]
    },
    {
      "inlet": 0,
      "at_ms": 40,
      "message": [
        0
      ]
    },
    {
      "inlet": 0,
      "at_ms": 60,
      "message": [
        1
      ]
    },
    {
      "inlet": 0,
      "at_ms": 80,
      "message": [
        34
      ]
    },
    {
      "inlet": 0,
      "at_ms": 100,
      "message": [
        "dump"
      ]
    }
  ],
  "expect": [
    {
      "outlet": 0,
      "kind": "control",
      "min_messages": 3,
      "type": "float",
      "exact": [
        [
          1
        ],
        [
          0
        ],
        [
          0.5
        ]
      ],
      "range": [
        0,
        1
      ]
    },
    {
      "outlet": 1,
      "kind": "control",
      "min_messages": 1,
      "type": "list",
      "exact": [
        [
          1,
          0,
          0.5,
          0,
          0,
          0,
          0,
          0,
          0,
          0,
          0,
          0,
          0,
          0,
          0,
          0,
          0,
          0,
          0,
          0,
          0,
          0,
          0,
          0,
          0,
          0,
          0,
          0,
          0,
          0,
          0,
          0
        ]
      ]
    }
  ],
  "notes": "Right inlet installs a complete32-step pattern. Left reads index modulo32;34 reads step2. Dump returns the complete table on outlet1."
}
