{
  "name": "u_bandpass1",
  "args": [
    1000,
    100
  ],
  "source": "rj/u_bandpass1-help.pd:1-55 + rj/u_bandpass1.pd:2-80,199-220,270-335",
  "duration_ms": 100,
  "stimuli": [
    {
      "inlet": 0,
      "at_ms": 10,
      "message": [
        1000
      ]
    },
    {
      "inlet": 1,
      "at_ms": 20,
      "message": [
        100
      ]
    },
    {
      "inlet": 0,
      "at_ms": 30,
      "message": [
        "bang"
      ]
    }
  ],
  "expect": [
    {
      "outlet": 0,
      "kind": "control",
      "min_messages": 3,
      "type": "list",
      "exact": [
        [
          1.7435948720688565,
          -0.8168593107377419,
          0.12768483590211746,
          0.0,
          -0.12768483590211746
        ],
        [
          1.7435948720688565,
          -0.8168593107377419,
          0.12768483590211746,
          0.0,
          -0.12768483590211746
        ],
        [
          1.7435948720688565,
          -0.8168593107377419,
          0.12768483590211746,
          0.0,
          -0.12768483590211746
        ]
      ],
      "range": [
        -2,
        2
      ]
    }
  ],
  "notes": "RBJ constant-skirt-gain bandpass coefficient generator, not an audio processor. Both frequency and bandwidth inputs are hot. At SR22050/f1000 it must output [2*cos(w)/(1+alpha), -(1-alpha)/(1+alpha), b0/(1+alpha), b1/(1+alpha), b2/(1+alpha)] in Pd biquad order. Source scales bandwidth by 0.01: 100 units per octave; alpha=sin(w)*sinh(log(2)/2*BW*w/sin(w)). Creation values prevent zero-width startup; repeated equal values and bang must reproduce the same five coefficients."
}
